<?xml version="1.0" encoding="UTF-8"?>
<questionnair-definition xmlns:xsi="http://www.w3.org/2001/XMLSchema-instance"
	xsi:noNamespaceSchemaLocation="questionnair-definition.xsd">
	<language>language</language>
	<language-settings>
		<description>description</description>
		<title>title</title>
		<welcomeText>welcomeText</welcomeText>
	</language-settings>
	<question-groups>
		<question-group>
			<language>EN</language>
			<language-settings>
				<title>Page 1</title>
			</language-settings>

			<questions>
				<question>

				</question>
			</questions>
			<translations/>
		</question-group>
	</question-groups>
	<mail-templates>
		<entry>
			<key>key</key>
			<value>
				<language>language</language>
				<from-address>from-address</from-address>
				<reply-to>reply-to</reply-to>
				<language-settings>
					<body>body</body>
					<subject>subject</subject>
				</language-settings>
				<translations>
					<entry>
						<key>key</key>
						<value>
							<languageSettings>
								<body>body</body>
								<subject>subject</subject>
							</languageSettings>
						</value>
					</entry>
				</translations>
			</value>
		</entry>
	</mail-templates>
	<translations>
		<entry>
			<key>key</key>
			<value>
				<languageSettings>
					<description>description</description>
					<title>title</title>
					<welcomeText>welcomeText</welcomeText>
				</languageSettings>
			</value>
		</entry>
	</translations>
	<welcome-visible>welcome-visible</welcome-visible>
	<progress-visible>progress-visible</progress-visible>
	<question-group-info-visible>question-group-info-visible</question-group-info-visible>
	<randomization-strategy>randomization-strategy</randomization-strategy>
</questionnair-definition>
